{"counts":{"total":2,"passed":2,"failed":0,"cancelled":0},"speechStartToFirstPartialMs":{"p50":100,"p95":150,"p99":180},"endpointToFinalMs":{"p50":120,"p95":180,"p99":200},"ttsTimeToFirstAudioMs":{"p50":1,"p95":2,"p99":3},"rtf":{"p50":0.2,"p95":0.3,"p99":0.4},"wer":0.1,"cer":0.05,"partialRevisionCount":3,"partialChurnCharacters":8,"underruns":0,"droppedFrames":0,"peakVramBytes":1000,"steadyVramBytes":800,"failures":[{"sourceId":"fixture","code":"none","stage":"score","message":"fixture"}],"soak":{"durationSeconds":1800,"passed":true,"severeFailures":0,"underruns":0,"droppedFrames":0,"expectedFrames":0,"consumedFrames":0,"expectedChunks":0,"consumedChunks":0,"deadlineOverruns":0,"deadlineLatenessP95Ms":0,"deadlineLatenessMaxMs":0,"timingConformance":true,"resetCount":0,"workerLeaks":0}}
